{
  "schema": "receiptos.verify.report.v1",
  "projection_version": "receiptos.verify.projection.v1",
  "overall": "VERIFIED",
  "reason_codes": [
    "NATIVE_CRYSTAL_ROOT_MATCH",
    "rvr.v0.digest_match",
    "rvr.recompute.identical",
    "SEMANTIC_REQUIREMENT_ESTABLISHED"
  ],
  "explanation": "VERIFIED. The caller-selected subject and policy match the covered subject and policy. NATIVE_CRYSTAL_ROOT_MATCH, rvr.v0.digest_match, rvr.recompute.identical, SEMANTIC_REQUIREMENT_ESTABLISHED",
  "required_layers": [
    "INTEGRITY",
    "AUTHENTICITY",
    "SUBJECT_BINDING",
    "RECOMPUTATION",
    "EVIDENCE_SUFFICIENCY",
    "SEMANTIC_COMPATIBILITY"
  ],
  "layers": {
    "INPUT": {
      "status": "ADMITTED",
      "reasonCodes": [],
      "nativeResult": null
    },
    "CANONICALIZATION": {
      "status": "VERIFIED",
      "reasonCodes": [],
      "nativeResult": {
        "profile": "receiptos.verify.canonical-json.v1",
        "statement_digest": "3373db70d925b7b5614818a61969c21f3fd39126a9337e049322f7c2e5892f9c"
      }
    },
    "INTEGRITY": {
      "status": "VERIFIED",
      "reasonCodes": [
        "NATIVE_CRYSTAL_ROOT_MATCH"
      ],
      "nativeResult": {
        "ok": true,
        "receipt_root": "0x925dd296e326196f1cd753f7b8f82bb4a7addc5a75651c808f4db79e5738712b",
        "recomputed_root": "0x925dd296e326196f1cd753f7b8f82bb4a7addc5a75651c808f4db79e5738712b"
      },
      "limitations": [
        "The native root excludes the entire top-level anchor and does not authenticate its metadata.",
        "Root equality does not establish claim correctness, signatures, Git membership or execution.",
        "This narrow adapter invokes native root verification, not a complete issuance or schema evaluator."
      ],
      "provenance": {
        "profileId": "crystal.handoff-receipt-root.v1",
        "sourceRepository": "https://github.com/pipavlo82/crystal-receipt",
        "sourceCommit": "45b46bf7df3a60b32583291f577a36bf19d22f00",
        "license": "Apache-2.0",
        "maturity": "STABLE",
        "capabilities": [
          "NATIVE_RECEIPT_ROOT_INTEGRITY"
        ],
        "requiredEvidence": [
          "native-crystal-evidence"
        ],
        "nativeVocabulary": {
          "integrity": [
            "ok:true",
            "ok:false"
          ],
          "fields": [
            "ok",
            "receipt_root",
            "recomputed_root"
          ]
        },
        "runtime": "Bun 1.3.14",
        "functions": [
          "verifyHandoffReceiptRoot"
        ]
      },
      "execution": {
        "status": "COMPLETED",
        "argv": [
          "C:/Users/msi/.bun/bin/bun.exe",
          "C:\\Users\\msi\\Documents\\Codex\\2026-10-11\\files-pasted-by-the-user-mission\\outputs\\receiptos-verify\\reports\\tmp\\vm2\\reports\\tmp\\mutant-ignore-policy-version\\src\\adapters\\native\\crystal-bridge.ts"
        ],
        "exitCode": 0,
        "signal": null,
        "stdout": "{\"ok\":true,\"value\":{\"ok\":true,\"receipt_root\":\"0x925dd296e326196f1cd753f7b8f82bb4a7addc5a75651c808f4db79e5738712b\",\"recomputed_root\":\"0x925dd296e326196f1cd753f7b8f82bb4a7addc5a75651c808f4db79e5738712b\"},\"runtime\":\"Bun 1.3.14\"}\n",
        "stderr": "",
        "stdoutSha256": "132c9d69d935c3ce91f10b56022945963d180d417fc2243d7657411e1bb793cc",
        "stderrSha256": "e3b0c44298fc1c149afbf4c8996fb92427ae41e4649b934ca495991b7852b855",
        "truncated": false
      }
    },
    "AUTHENTICITY": {
      "status": "VERIFIED",
      "reasonCodes": [],
      "nativeResult": {
        "provider": "ed25519",
        "key_id": "synthetic-demo",
        "key_scope": "caller-selected trust policy"
      }
    },
    "SUBJECT_BINDING": {
      "status": "VERIFIED",
      "reasonCodes": [],
      "nativeResult": {
        "requested": {
          "kind": "git-artifact",
          "id": "demo:receiptos",
          "artifact_digest": "d2e38028b7a4646eb46c8af0450d19e3f128d5c5b9dbbdb8518abab37b393933",
          "commit": "6d0d1867b0b3e1cb1c6c56caea39d583e4535250",
          "tree": "8d840f6a9837c1c8f75e7a051ddc2e993d0e5184",
          "artifact_path": "result.txt",
          "version": "1"
        },
        "covered": {
          "kind": "git-artifact",
          "id": "demo:receiptos",
          "artifact_digest": "d2e38028b7a4646eb46c8af0450d19e3f128d5c5b9dbbdb8518abab37b393933",
          "commit": "6d0d1867b0b3e1cb1c6c56caea39d583e4535250",
          "tree": "8d840f6a9837c1c8f75e7a051ddc2e993d0e5184",
          "artifact_path": "result.txt",
          "version": "1"
        }
      },
      "explanation": "The caller-selected subject and policy match the covered subject and policy."
    },
    "RECOMPUTATION": {
      "status": "REPRODUCED",
      "reasonCodes": [
        "rvr.v0.digest_match",
        "rvr.recompute.identical"
      ],
      "nativeResult": {
        "verificationOutcome": "VERIFIED",
        "verificationReasonCode": "rvr.v0.digest_match",
        "recomputationStatus": "REPRODUCED",
        "reasonCode": "rvr.recompute.identical",
        "evaluationPerformed": true,
        "canonicalResultDigest": "49df175105cda22bf42796ae08ed1162e22a771cd0bc5a3193c1bdc48be415a4"
      },
      "semanticOutcome": "VERIFIED",
      "recomputationStatus": "REPRODUCED",
      "observedArtifactDigest": "d2e38028b7a4646eb46c8af0450d19e3f128d5c5b9dbbdb8518abab37b393933",
      "expectedDigest": "d2e38028b7a4646eb46c8af0450d19e3f128d5c5b9dbbdb8518abab37b393933",
      "nativeCanonicalResult": {
        "schema": "rvr.canonical-result.v0",
        "outcome": "VERIFIED",
        "reasonCode": "rvr.v0.digest_match",
        "evaluation": {
          "operation": "SHA256_EQUALS",
          "evidenceMember": "artifact",
          "expectedDigest": "d2e38028b7a4646eb46c8af0450d19e3f128d5c5b9dbbdb8518abab37b393933",
          "observedDigest": "d2e38028b7a4646eb46c8af0450d19e3f128d5c5b9dbbdb8518abab37b393933"
        }
      },
      "savedCanonicalResult": {
        "schema": "rvr.canonical-result.v0",
        "outcome": "VERIFIED",
        "reasonCode": "rvr.v0.digest_match",
        "evaluation": {
          "operation": "SHA256_EQUALS",
          "evidenceMember": "artifact",
          "expectedDigest": "d2e38028b7a4646eb46c8af0450d19e3f128d5c5b9dbbdb8518abab37b393933",
          "observedDigest": "d2e38028b7a4646eb46c8af0450d19e3f128d5c5b9dbbdb8518abab37b393933"
        }
      },
      "limitations": [
        "Generic RVR SHA256_EQUALS has no Git commit binding or signature/authenticity guarantee.",
        "REPRODUCED can reproduce REFUTED or UNVERIFIABLE and does not imply semantic success.",
        "Only the exact installed generic profile is admitted; external/domain profiles are unsupported."
      ],
      "provenance": {
        "profileId": "rvr-generic-sha256-equals-v0",
        "sourceRepository": "https://github.com/pipavlo82/recomputable-verification-receipts",
        "sourceCommit": "9dd36e882dd372f264b77b179130948aa5adcbde",
        "license": "Apache-2.0",
        "maturity": "STABLE",
        "capabilities": [
          "NATIVE_DIGEST_PREDICATE",
          "NATIVE_RECEIPT_REPLAY"
        ],
        "requiredEvidence": [
          "native-rvr-bundle",
          "native-rvr-candidate"
        ],
        "nativeVocabulary": {
          "semantic": [
            "VERIFIED",
            "REFUTED",
            "UNVERIFIABLE"
          ],
          "recomputation": [
            "REPRODUCED",
            "DIVERGED",
            "CANNOT_RECOMPUTE"
          ]
        },
        "runtime": "Python 3.12.10",
        "verificationProfileDigest": "51f79442e96339ca45e9e6cc0c8232833efbee20e7480df00987dbc97da72948",
        "functions": [
          "audit_profile",
          "validate_receipt_envelope",
          "recompute",
          "evaluate"
        ]
      },
      "execution": {
        "status": "COMPLETED",
        "argv": [
          "python",
          "-I",
          "-B",
          "-X",
          "utf8",
          "C:\\Users\\msi\\Documents\\Codex\\2026-10-11\\files-pasted-by-the-user-mission\\outputs\\receiptos-verify\\reports\\tmp\\vm2\\reports\\tmp\\mutant-ignore-policy-version\\src\\adapters\\native\\rvr-bridge.py"
        ],
        "exitCode": 0,
        "signal": null,
        "stdout": "{\"ok\":true,\"value\":{\"verificationOutcome\":\"VERIFIED\",\"verificationReasonCode\":\"rvr.v0.digest_match\",\"recomputationStatus\":\"REPRODUCED\",\"reasonCode\":\"rvr.recompute.identical\",\"evaluationPerformed\":true,\"canonicalResultDigest\":\"49df175105cda22bf42796ae08ed1162e22a771cd0bc5a3193c1bdc48be415a4\"},\"canonicalResult\":{\"schema\":\"rvr.canonical-result.v0\",\"outcome\":\"VERIFIED\",\"reasonCode\":\"rvr.v0.digest_match\",\"evaluation\":{\"operation\":\"SHA256_EQUALS\",\"evidenceMember\":\"artifact\",\"expectedDigest\":\"d2e38028b7a4646eb46c8af0450d19e3f128d5c5b9dbbdb8518abab37b393933\",\"observedDigest\":\"d2e38028b7a4646eb46c8af0450d19e3f128d5c5b9dbbdb8518abab37b393933\"}},\"profileDigest\":\"51f79442e96339ca45e9e6cc0c8232833efbee20e7480df00987dbc97da72948\",\"runtime\":\"Python 3.12.10\"}\r\n",
        "stderr": "",
        "stdoutSha256": "0344009108627ab9d47aa4112e8ba933f0e2f2348632dcc58aaa64352d04e344",
        "stderrSha256": "e3b0c44298fc1c149afbf4c8996fb92427ae41e4649b934ca495991b7852b855",
        "truncated": false
      },
      "adapterProjection": "VERIFIED"
    },
    "EVIDENCE_SUFFICIENCY": {
      "status": "SUFFICIENT",
      "reasonCodes": [],
      "nativeResult": {
        "grade": "LOCAL_RECOMPUTATION",
        "git": {
          "ok": true,
          "commit": "6d0d1867b0b3e1cb1c6c56caea39d583e4535250",
          "tree": "8d840f6a9837c1c8f75e7a051ddc2e993d0e5184",
          "blob": "304b52af50041460c25ad4607981fe3c3de61b0b",
          "path": "result.txt"
        }
      }
    },
    "SEMANTIC_COMPATIBILITY": {
      "status": "COMPATIBLE",
      "reasonCodes": [
        "SEMANTIC_REQUIREMENT_ESTABLISHED"
      ],
      "nativeResult": {
        "valid": true,